{
  "analysisId": "11111111-1111-4111-8111-111111111111",
  "attemptId": "22222222-2222-4222-8222-222222222222",
  "targetText": "The number of students has increased.",
  "sources": ["local_signal"],
  "signalMetrics": {
    "durationMs": 3200,
    "speechRatio": 0.78,
    "clippingDetected": false,
    "nearSilenceDetected": false
  },
  "observations": [],
  "algorithmVersion": "pronunciation-local-v1",
  "createdAt": "2026-09-19T00:00:00Z",
  "schemaVersion": 2
}
